{
  "goal_id": "IMPORT_FULL_REPO",
  "goal_version": 1,
  "criterion": "Все entries архива учтены с полными путями",
  "truth": "NOT_RUN",
  "source_refs": [],
  "verifier": "inventory_and_hash_roundtrip",
  "snapshot_sha": null,
  "observed_at": null,
  "model_probability": null,
  "reason": "Запустите на реальном ZIP пользователя."
}
